{
  "$schema": "http://json-schema.org/draft-07/schema#",
  "$id": "https://github.com/hubmapconsortium/prov-vis/#schema",
  "title": "HuBMAP PROV schema",
  "type": "object",
  "definitions": {
    "string_to_string": {
      "type": "object",
      "patternProperties": {
        ".": {
          "type": "string"
        }
      }
    },
    "string_to_string_to_string": {
      "type": "object",
      "patternProperties": {
        ".": {
          "$ref": "#/definitions/string_to_string"
        }
      }
    }
  },
  "additionalProperties": false,
  "required": ["prefix", "entity", "activity", "wasGeneratedBy", "used"],
  "properties": {
    "prefix": {
      "allOf": [
        { "$ref": "#/definitions/string_to_string" },
        { "$comment": "TODO: Add 'prov'." }
      ]
    },
    "entity": { "$ref": "#/definitions/string_to_string_to_string" },
    "activity": { "$ref": "#/definitions/string_to_string_to_string" },
    "wasGeneratedBy": { "$ref": "#/definitions/string_to_string_to_string" },
    "used": { "$ref": "#/definitions/string_to_string_to_string" },
    "agent": { "$ref": "#/definitions/string_to_string_to_string" },
    "actedOnBehalfOf": { "$ref": "#/definitions/string_to_string_to_string" }
  }
}
